Sheet: 属性模板
A1: 模板ID | B1: 职业名 | C1: 属性映射名 | D1: 移动速度 | E1: 攻击速度 | F1: 物理攻击力 | G1: HP | H1: MP1 | I1: HP回复 | J1: MP1回复 | K1: 护甲值 | L1: 护甲忽视 | M1: 攻击范围 | N1: 普通攻击暴击等级 | O1: 普通攻击暴击伤害 | P1: 普通攻击暴击抗性 | Q1: 普通攻击闪躲 | R1: 普通攻击命中等级 | S1: 魔法攻击力 | T1: 魔法抗性 | U1: 魔抗忽视 | V1: 魔法暴击等级 | W1: 魔法攻击暴击伤害 | X1: 魔法攻击暴击抗性 | Y1: 魔法攻击闪躲等级 | Z1: 魔法攻击命中等级 | AA1: 吸血等级 | AB1: buff抗性
A2: main_id | B2: name | C2: attributeName | D2: moveSpeed | E2: attackSpeed | F2: attackDamage | G2: hp | H2: mp1 | I2: hpRecover | J2: mp1Recover | K2: armor | L2: armorIgnore | M2: attackRange | N2: attackStrikeLevel | O2: attackStrikeDamage | P2: attackStrikeResistance | Q2: attackDodge | R2: attackHit | S2: skillDamage | T2: skillResistance | U2: skillResistanceIgnore | V2: skillStrikeLevel | W2: skillStrikeDamage | X2: skillStrikeResistance | Y2: skillDodgeLevel | Z2: skillHitLevel | AA2: suckBloodLevel | AB2: buffResistance
A3: 1 | B3: 战士 | C3: Warrior | D3: 90 | E3: 200 | F3: 100 | G3: 1000 | H3: 100 | I3: 5 | J3: 0.5 | K3: 50 | L3: 0 | M3: 100 | N3: 10 | O3: 150 | P3: 10 | Q3: 10 | R3: 10 | S3: =R[2]C*0.3 -> 39 | T3: 30 | U3: 10 | V3: 10 | W3: 180 | X3: 10 | Y3: 10 | Z3: 10 | AA3: 0 | AB3: 0
A4: 2 | B4: 弓箭手 | C4: Archer | D4: 110 | E4: 150 | F4: =R[-1]C*0.7 -> 70 | G4: =R[-1]C*0.7 -> 700 | H4: =R[5]C*1.2 -> 114 | I4: 3 | J4: =R[1]C*0.7 -> 0.7 | K4: =R[-1]C*0.7 -> 35 | L4: 0 | M4: 400 | N4: 10 | O4: 150 | P4: 10 | Q4: 10 | R4: 10 | S4: =R[1]C*0.5 -> 65 | T4: =R[-1]C*0.7 -> 21 | U4: 10 | V4: 10 | W4: 180 | X4: 10 | Y4: 10 | Z4: 10 | AA4: 0 | AB4: 0
A5: 3 | B5: 法师 | C5: Mage | D5: 80 | E5: 250 | F5: =R[-2]C*0.5 -> 50 | G5: =R[-2]C*0.6 -> 600 | H5: =R[4]C*1.5 -> 142.5 | I5: 2 | J5: 1 | K5: =R[-2]C*0.5 -> 25 | L5: 0 | M5: 300 | N5: 10 | O5: 150 | P5: 10 | Q5: 10 | R5: 10 | S5: 130 | T5: =R[-1]C*0.7 -> 14.7 | U5: 10 | V5: 10 | W5: 180 | X5: 10 | Y5: 10 | Z5: 10 | AA5: 0 | AB5: 0
A6: 4 | B6: 刺客 | C6: Assassin | D6: 110 | E6: 200 | F6: 100 | G6: =R[-3]C*0.8 -> 800 | H6: =R[3]C*0.8 -> 76 | I6: 2 | J6: 1 | K6: 50 | L6: 0 | M6: 100 | N6: 10 | O6: 150 | P6: 10 | Q6: 10 | R6: 10 | S6: 50 | T6: =R[-1]C*0.7 -> 10.29 | U6: 10 | V6: 10 | W6: 180 | X6: 10 | Y6: 10 | Z6: 10 | AA6: 0 | AB6: 0
A7: 5 | B7: 牧师 | C7: Cergy | D7: 80 | E7: 200 | F7: 100 | G7: =R3C*0.65 -> 650 | H7: =R9C*0.65 -> 61.75 | I7: 2 | J7: 1 | K7: 50 | L7: 0 | M7: 300 | N7: 10 | O7: 150 | P7: 10 | Q7: 10 | R7: 10 | S7: 50 | T7: =R[-1]C*0.7 -> 7.203 | U7: 10 | V7: 10 | W7: 180 | X7: 10 | Y7: 10 | Z7: 10 | AA7: 0 | AB7: 0
A8: 6 | B8: 圣骑士 | C8: Paladin | D8: 90 | E8: 200 | F8: 100 | G8: =R[-5]C*1.15 -> 1150 | H8: =R[1]C*1.15 -> 109.25 | I8: 2 | J8: 1 | K8: 50 | L8: 0 | M8: 100 | N8: 10 | O8: 150 | P8: 10 | Q8: 10 | R8: 10 | S8: 50 | T8: =R[-1]C*0.7 -> 5.0421 | U8: 10 | V8: 10 | W8: 180 | X8: 10 | Y8: 10 | Z8: 10 | AA8: 0 | AB8: 0
A9: 7 | B9: 坦克 | C9: Tank | D9: 100 | E9: 200 | F9: 100 | G9: 1300 | H9: =R[-6]C*0.95 -> 95 | I9: 2 | J9: 1 | K9: 50 | L9: 0 | M9: 100 | N9: 10 | O9: 150 | P9: 10 | Q9: 10 | R9: 10 | S9: 50 | T9: =R[-1]C*0.7 -> 3.52947 | U9: 10 | V9: 10 | W9: 180 | X9: 10 | Y9: 10 | Z9: 10 | AA9: 0 | AB9: 0